[
    {
        "Ideas": [
            {
                "Name": "Nonlinear damping",
                "Reasoning": "Incorporating a damping term that increases nonlinearly with velocity can capture complex behavior in the system where energy loss isn't linearly proportional to speed.",
                "Definition": "Adding a term like `-params[4] * v**3` in the acceleration function to represent nonlinear damping."
            },
            {
                "Name": "Nonlinear driving force",
                "Reasoning": "Including a driving force that varies nonlinearly with position can introduce intricate dynamics to the oscillator system.",
                "Definition": "Integrating a term such as `params[5] * x**2` in the acceleration function to account for the nonlinear driving force."
            },
            {
                "Name": "Frictional effects",
                "Reasoning": "Modeling frictional forces can elucidate the impact of energy dissipation on the oscillator's acceleration.",
                "Definition": "Including a frictional term like `-params[6] * v**2` in the acceleration function to represent frictional effects."
            }
        ],
        "Thoughts": "To create the mathematical function for acceleration in the damped nonlinear oscillator system with a driving force, the following steps can be taken:\n1. Start with the basic acceleration equation.\n2. Incorporate the nonlinear damping term to represent the nonlinear relationship between damping and velocity.\n3. Integrate the nonlinear driving force term to capture the effect of the driving force nonlinearly dependent on position.\n4. Include the frictional term to account for energy dissipation due to frictional forces.\n5. Combine all the terms with appropriate coefficients as specified by `params`.\n\n",
        "Solutions": {
            "Natural Language English": "The mathematical function for acceleration in the damped nonlinear oscillator system includes terms for nonlinear damping, nonlinear driving force, and frictional effects, each with their respective coefficients specified in the `params` array.",
            "Python Code": "import numpy as np\ndef equation(t: np.ndarray, x: np.ndarray, v: np.ndarray, params: np.ndarray) -> np.ndarray:\n    \"\"\" Mathematical function for acceleration in a damped nonlinear oscillator\n\n    Args:\n        t: A numpy array representing time.\n        x: A numpy array representing observations of current position.\n        v: A numpy array representing observations of velocity.\n        params: Array of numeric constants or parameters to be optimized, where params[4], params[5], and params[6] represent coefficients for nonlinear damping, nonlinear driving force, and frictional effects respectively.\n    Return:\n        A numpy array representing acceleration as the result of applying the mathematical function to the inputs.\n    \"\"\"\n    dv = params[0] * t + params[1] * x + params[2] * v - params[4] * v**3 + params[5] * x**2 - params[6] * v**2\n    return dv",
            "Mathematical Formula": "Acceleration function:\n\\[ dv = params[0] \\times t + params[1] \\times x + params[2] \\times v - params[4] \\times v^3 + params[5] \\times x^2 - params[6] \\times v^2 \\]"
        },
        "raw_content": "## Ideas\n- Idea 1:\n  - Name: Nonlinear damping\n  - Reasoning: Incorporating a damping term that increases nonlinearly with velocity can capture complex behavior in the system where energy loss isn't linearly proportional to speed.\n  - Definition: Adding a term like `-params[4] * v**3` in the acceleration function to represent nonlinear damping.\n\n- Idea 2:\n  - Name: Nonlinear driving force\n  - Reasoning: Including a driving force that varies nonlinearly with position can introduce intricate dynamics to the oscillator system.\n  - Definition: Integrating a term such as `params[5] * x**2` in the acceleration function to account for the nonlinear driving force.\n\n- Idea 3:\n  - Name: Frictional effects\n  - Reasoning: Modeling frictional forces can elucidate the impact of energy dissipation on the oscillator's acceleration.\n  - Definition: Including a frictional term like `-params[6] * v**2` in the acceleration function to represent frictional effects.\n\n## Thoughts\nTo create the mathematical function for acceleration in the damped nonlinear oscillator system with a driving force, the following steps can be taken:\n1. Start with the basic acceleration equation.\n2. Incorporate the nonlinear damping term to represent the nonlinear relationship between damping and velocity.\n3. Integrate the nonlinear driving force term to capture the effect of the driving force nonlinearly dependent on position.\n4. Include the frictional term to account for energy dissipation due to frictional forces.\n5. Combine all the terms with appropriate coefficients as specified by `params`.\n\n## Solutions\n### Natural Language English:\nThe mathematical function for acceleration in the damped nonlinear oscillator system includes terms for nonlinear damping, nonlinear driving force, and frictional effects, each with their respective coefficients specified in the `params` array.\n\n### Python Code:\n```python\nimport numpy as np\ndef equation(t: np.ndarray, x: np.ndarray, v: np.ndarray, params: np.ndarray) -> np.ndarray:\n    \"\"\" Mathematical function for acceleration in a damped nonlinear oscillator\n\n    Args:\n        t: A numpy array representing time.\n        x: A numpy array representing observations of current position.\n        v: A numpy array representing observations of velocity.\n        params: Array of numeric constants or parameters to be optimized, where params[4], params[5], and params[6] represent coefficients for nonlinear damping, nonlinear driving force, and frictional effects respectively.\n    Return:\n        A numpy array representing acceleration as the result of applying the mathematical function to the inputs.\n    \"\"\"\n    dv = params[0] * t + params[1] * x + params[2] * v - params[4] * v**3 + params[5] * x**2 - params[6] * v**2\n    return dv\n```\n\n### Mathematical Formula:\nAcceleration function:\n\\[ dv = params[0] \\times t + params[1] \\times x + params[2] \\times v - params[4] \\times v^3 + params[5] \\times x^2 - params[6] \\times v^2 \\]",
        "error_msg": null,
        "fitness_string": "The residual error between the output and the ground truth is 0.031216202426775988",
        "fitness_list": [
            0.031216202426775988,
            0.5310022830963135
        ]
    },
    {
        "Ideas": [
            {
                "Quote": "\"Quadratic Damping\"",
                "Implication": "Quadratic damping can capture intensified damping effects associated with higher velocities in the oscillator system, providing a more accurate representation of the system's behavior over time.",
                "Name": "Quadratic Damping",
                "Reasoning": "By including a term like `params[2] * v**2` in the acceleration function, we can account for the increased damping impacts when the speed of the oscillator rises.",
                "Definition": "Integrating a term in the acceleration function to represent intensified damping effects associated with higher velocities."
            },
            {
                "Quote": "\"Memory Effects for Hysteresis\"",
                "Implication": "Introducing terms that incorporate memory effects from past velocities or positions can simulate hysteresis dynamics and characterize the system's behavior over time more realistically.",
                "Name": "Memory Effects for Hysteresis",
                "Reasoning": "By including a term such as `params[7] * np.gradient(v)` in the acceleration function, we can simulate the effect of hysteresis dynamics in the system, capturing past behaviors' influence on the current state.",
                "Definition": "Introducing terms in the acceleration function that incorporate memory effects from past velocities or positions to model hysteresis and characterize the system's behavior over time."
            },
            {
                "Quote": "\"Periodic External Driving Force\"",
                "Implication": "Integrating sinusoidal terms in the mathematical function can represent external periodic forces influencing the oscillating system, providing insights into how external influences affect the system's dynamics.",
                "Name": "Periodic External Driving Force",
                "Reasoning": "Utilizing a term like `params[7] * np.cos(params[8] * t)` in the acceleration function illustrates how periodic external influences can impact the oscillator's behavior over time, capturing periodic variations.",
                "Definition": "Integrating sinusoidal terms in the mathematical function to represent external periodic forces that influence the system's oscillations."
            }
        ],
        "Thoughts": "After considering the implications of the ideas, it's clear that combining quadratic damping, memory effects for hysteresis, and periodic external driving force terms in the acceleration function will provide a comprehensive model for the damped nonlinear oscillator system with driving force. This combined approach will capture the system's response to velocity-dependent damping, hysteresis effects, and external periodic influences, leading to a more accurate representation of the system's behavior over time.\n\n",
        "Solutions": {
            "Natural Language English": "To represent acceleration in a damped nonlinear oscillator system with driving force, the mathematical function should include terms for quadratic damping, memory effects for hysteresis, and periodic external driving force. The quadratic damping term captures intensified damping effects at higher velocities, memory effects simulate hysteresis dynamics, and the periodic external driving force models external influences on the system's behavior over time.",
            "Python Code": "import numpy as np\ndef equation(t: np.ndarray, x: np.ndarray, v: np.ndarray, params: np.ndarray) -> np.ndarray:\n    \"\"\" Mathematical function for acceleration in a damped nonlinear oscillator\n\n    Args:\n        t: A numpy array representing time.\n        x: A numpy array representing observations of current position.\n        v: A numpy array representing observations of velocity.\n        params: Array of numeric constants or parameters to be optimized, where params[2], params[7], and params[8] correspond to quadratic damping, memory effects for hysteresis, and periodic external driving force terms respectively.\n    Return:\n        A numpy array representing acceleration as the result of applying the mathematical function to the inputs.\n    \"\"\"\n    dv = params[0] * t + params[1] * x + params[2] * v**2 + params[7] * np.gradient(v) + params[8] * np.cos(params[9] * t)\n    return dv",
            "Mathematical Formula": "Acceleration Function: \n\\[ dv = params[0] \\times t + params[1] \\times x + params[2] \\times v^2 + params[7] \\times \\frac{d(v)}{dt} + params[8] \\times \\cos(params[9] \\times t) \\]"
        },
        "raw_content": "## Ideas\n  - Idea 1:\n    - Quotes: \"Quadratic Damping\"\n    - Implications: Quadratic damping can capture intensified damping effects associated with higher velocities in the oscillator system, providing a more accurate representation of the system's behavior over time.\n    - Name: Quadratic Damping\n    - Reasoning: By including a term like `params[2] * v**2` in the acceleration function, we can account for the increased damping impacts when the speed of the oscillator rises.\n    - Definition: Integrating a term in the acceleration function to represent intensified damping effects associated with higher velocities.\n  \n  - Idea 2:\n    - Quotes: \"Memory Effects for Hysteresis\"\n    - Implications: Introducing terms that incorporate memory effects from past velocities or positions can simulate hysteresis dynamics and characterize the system's behavior over time more realistically.\n    - Name: Memory Effects for Hysteresis\n    - Reasoning: By including a term such as `params[7] * np.gradient(v)` in the acceleration function, we can simulate the effect of hysteresis dynamics in the system, capturing past behaviors' influence on the current state.\n    - Definition: Introducing terms in the acceleration function that incorporate memory effects from past velocities or positions to model hysteresis and characterize the system's behavior over time.\n  \n  - Idea 3:\n    - Quotes: \"Periodic External Driving Force\"\n    - Implications: Integrating sinusoidal terms in the mathematical function can represent external periodic forces influencing the oscillating system, providing insights into how external influences affect the system's dynamics.\n    - Name: Periodic External Driving Force\n    - Reasoning: Utilizing a term like `params[7] * np.cos(params[8] * t)` in the acceleration function illustrates how periodic external influences can impact the oscillator's behavior over time, capturing periodic variations.\n    - Definition: Integrating sinusoidal terms in the mathematical function to represent external periodic forces that influence the system's oscillations.\n\n## Thoughts\nAfter considering the implications of the ideas, it's clear that combining quadratic damping, memory effects for hysteresis, and periodic external driving force terms in the acceleration function will provide a comprehensive model for the damped nonlinear oscillator system with driving force. This combined approach will capture the system's response to velocity-dependent damping, hysteresis effects, and external periodic influences, leading to a more accurate representation of the system's behavior over time.\n\n## Solutions\n### Natural Language English:\nTo represent acceleration in a damped nonlinear oscillator system with driving force, the mathematical function should include terms for quadratic damping, memory effects for hysteresis, and periodic external driving force. The quadratic damping term captures intensified damping effects at higher velocities, memory effects simulate hysteresis dynamics, and the periodic external driving force models external influences on the system's behavior over time.\n\n### Python Code:\n```python\nimport numpy as np\ndef equation(t: np.ndarray, x: np.ndarray, v: np.ndarray, params: np.ndarray) -> np.ndarray:\n    \"\"\" Mathematical function for acceleration in a damped nonlinear oscillator\n\n    Args:\n        t: A numpy array representing time.\n        x: A numpy array representing observations of current position.\n        v: A numpy array representing observations of velocity.\n        params: Array of numeric constants or parameters to be optimized, where params[2], params[7], and params[8] correspond to quadratic damping, memory effects for hysteresis, and periodic external driving force terms respectively.\n    Return:\n        A numpy array representing acceleration as the result of applying the mathematical function to the inputs.\n    \"\"\"\n    dv = params[0] * t + params[1] * x + params[2] * v**2 + params[7] * np.gradient(v) + params[8] * np.cos(params[9] * t)\n    return dv\n```\n\n### Mathematical Formula:\nAcceleration Function: \n\\[ dv = params[0] \\times t + params[1] \\times x + params[2] \\times v^2 + params[7] \\times \\frac{d(v)}{dt} + params[8] \\times \\cos(params[9] \\times t) \\]",
        "error_msg": null,
        "fitness_string": "The residual error between the output and the ground truth is 1.5851720209760776e-10",
        "fitness_list": [
            1.5851720209760776e-10,
            0.40555834770202637
        ]
    }
]